<?xml version="1.0" encoding="UTF-8" ?>
<gamblers  xmlns:xsi="http://www.w3.org/2001/XMLSchema-instance"
           xmlns="http://jd02_09.yarmolenka.it.by/beans+att"
           xsi:schemaLocation="http://jd02_09.yarmolenka.it.by/beans+att gamblers+att.xsd"
>
    <gambler nickname="first">
        <login>first_gambler</login>
        <password>password1</password>
        <email>gambler1@mail.ru</email>
        <bets max="100">
            <bet>
                <sport>soccer</sport>
                <event>match1</event>
                <actual_bet>W1</actual_bet>
                <odds>2.4</odds>
                <actual_result>X</actual_result>
                <bet_amount>100</bet_amount>
                <payout>0</payout>
            </bet>
            <bet>
                <sport>soccer</sport>
                <event>match2</event>
                <actual_bet>W2</actual_bet>
                <odds>2.1</odds>
                <actual_result>W2</actual_result>
                <bet_amount>100</bet_amount>
                <payout>210</payout>
            </bet>
        </bets>
    </gambler>
    <gambler nickname="second">
        <login>second_gambler</login>
        <password>password2</password>
        <email>gambler2@mail.ru</email>
        <bets max="50">
            <bet>
                <sport>hockey</sport>
                <event>match3</event>
                <actual_bet>W1</actual_bet>
                <odds>3.7</odds>
                <actual_result>W1</actual_result>
                <bet_amount>100</bet_amount>
                <payout>370</payout>
            </bet>
        </bets>
    </gambler>
</gamblers>